{
  "claim": {
    "action": "commit",
    "claim": "Shipped Rosendaltown change: corrected category image/content mapping and refreshed homepage imagery with the real Rosendal photos.",
    "created_at": "2026-09-15T13:39:37.597558+00:00",
    "evidence": {
      "action": "commit",
      "action_id": "rosendaltown-commit-45bc7aa7f945",
      "details": {
        "commit": "45bc7aa7f9458ced34c97cd76a7e833c71632aaa",
        "repo": "buttercode101/rosendaltown",
        "source": "existing_real_project_commit",
        "summary": "Fix category image/content mismatch by mapping real Rosendal photos to each listing and updating homepage/category imagery.",
        "url": "https://github.com/buttercode101/rosendaltown/commit/45bc7aa7f9458ced34c97cd76a7e833c71632aaa"
      },
      "run_id": "45bc7aa7f9458ced34c97cd76a7e833c71632aaa",
      "source": "habitat_trusted_ledger",
      "status": "ok",
      "timestamp": "2026-09-15T13:39:37.000666+00:00"
    },
    "expected_status": "ok",
    "habitat_id": "real-projects",
    "id": "7b0dfe4e-fa51-44a7-8549-428083b666d9",
    "job_id": null,
    "run_id": "45bc7aa7f9458ced34c97cd76a7e833c71632aaa",
    "status": "verified",
    "verified_at": "2026-09-15T13:39:37.599886+00:00"
  },
  "content_sha256": "a21b7f2ff7c25c6b87d6d502bb0916d7423f4f46f3bb1f8349ddcf00818fc088",
  "generated_at": "2026-09-15T13:39:37.600511+00:00",
  "ledger": {
    "actions": [
      {
        "action": "commit",
        "actor": "github",
        "details": {
          "commit": "45bc7aa7f9458ced34c97cd76a7e833c71632aaa",
          "repo": "buttercode101/rosendaltown",
          "source": "existing_real_project_commit",
          "summary": "Fix category image/content mismatch by mapping real Rosendal photos to each listing and updating homepage/category imagery.",
          "url": "https://github.com/buttercode101/rosendaltown/commit/45bc7aa7f9458ced34c97cd76a7e833c71632aaa"
        },
        "habitat_id": "real-projects",
        "id": "rosendaltown-commit-45bc7aa7f945",
        "job_id": null,
        "run_id": "45bc7aa7f9458ced34c97cd76a7e833c71632aaa",
        "status": "ok",
        "timestamp": "2026-09-15T13:39:37.000666+00:00"
      }
    ],
    "integrity": "intact"
  },
  "proof_version": "1"
}
